<?xml version="1.0" encoding="UTF-8"?>
<circuitos xsi:schemaLocation="http://www.uniovi.es circuito.xsd"
xmlns:xsi="http://www.w5.org/2001/XMLSchema-instance" xmlns="http://www.uniovi.es">

    <circuito>
        <nombre>Petronas Sepang International Circuit </nombre>
        <longitud_circuito unidad="metros">5543</longitud_circuito>
        <anchura unidad="metros">16</anchura>
        <fecha>2025-10-26</fecha>
        <hora>08:00</hora>
        <vueltas>20</vueltas>
        <localidad>Sepang</localidad>
        <pais>Malasia</pais>
        <patrocinador>Petronas</patrocinador>
        <referencias>
            <referencia>https://www.motogp.com/en/calendar/2025/event/malaysia/c2cd8f49-5643-440f-84fc-4c37b3ef3f87?tab=overview</referencia>
            <referencia>https://en.wikipedia.org/wiki/Sepang_International_Circuit</referencia>
            <referencia>https://www.sepangcircuit.com/</referencia>
        </referencias>
        <fotografias>
            <fotografia>sepang-1.jpg</fotografia>
            <fotografia>sepang-2.jpg</fotografia>
            <fotografia>sepang-3.jpg</fotografia>
        </fotografias>
        <videos>
            <video>sepang-1.mp4</video>
        </videos>
        <origen>
            <latitud unidad = "grados">2.760760</latitud>
            <longitud unidad = "grados">101.738466</longitud>
            <altitud unidad = "metros">36</altitud>
        </origen>
        <tramos>
            <tramo>
                <distancia unidad="metros">626</distancia>
                <coordenadas>
                    <latitud unidad = "grados">2.7603</latitud>
                    <longitud unidad = "grados">101.7328</longitud>
                    <altitud unidad = "metros">37</altitud>
                </coordenadas>
                <sector>1</sector>
            </tramo>
            <tramo>
                <distancia unidad="metros">38</distancia>
                <coordenadas>
                    <latitud unidad = "grados">2.7606</latitud>
                    <longitud unidad = "grados">101.7325</longitud>
                    <altitud unidad = "metros">37</altitud>
                </coordenadas>
                <sector>1</sector>
            </tramo>
            <tramo>
                <distancia unidad="metros">32</distancia>
                <coordenadas>
                    <latitud unidad = "grados">2.760846</latitud>
                    <longitud unidad = "grados">101.732708</longitud>
                    <altitud unidad = "metros">37</altitud>
                </coordenadas>
                <sector>1</sector>
            </tramo>
            <tramo>
                <distancia unidad="metros">31</distancia>
                <coordenadas>
                    <latitud unidad = "grados">2.760933</latitud>
                    <longitud unidad = "grados">101.732970</longitud>
                    <altitud unidad = "metros">37</altitud>
                </coordenadas>
                <sector>1</sector>
            </tramo>
            <tramo>
                <distancia unidad="metros">61</distancia>
                <coordenadas>
                    <latitud unidad = "grados">2.7608333</latitud>
                    <longitud unidad = "grados">101.7333333</longitud>
                    <altitud unidad = "metros">35</altitud>
                </coordenadas>
                <sector>1</sector>
            </tramo>
            <tramo>
                <distancia unidad="metros">42</distancia>
                <coordenadas>
                    <latitud unidad = "grados">2.761222</latitud>
                    <longitud unidad = "grados">101.733522</longitud>
                    <altitud unidad = "metros">34</altitud>
                </coordenadas>
                <sector>1</sector>
            </tramo>
            <tramo>
                <distancia unidad="metros">71</distancia>
                <coordenadas>
                    <latitud unidad = "grados">2.7616667</latitud>
                    <longitud unidad = "grados">101.7330556</longitud>
                    <altitud unidad = "metros">30</altitud>
                </coordenadas>
                <sector>1</sector>
            </tramo>
            <tramo>
                <distancia unidad="metros">139</distancia>
                <coordenadas>
                    <latitud unidad = "grados">2.7627778</latitud>
                    <longitud unidad = "grados">101.7330556</longitud>
                    <altitud unidad = "metros">24</altitud>
                </coordenadas>
                <sector>1</sector>
            </tramo>
            <tramo>
                <distancia unidad="metros">109</distancia>
                <coordenadas>
                    <latitud unidad = "grados">2.7636111</latitud>
                    <longitud unidad = "grados">101.7336111</longitud>
                    <altitud unidad = "metros">22</altitud>
                </coordenadas>
                <sector>1</sector>
            </tramo>
            <tramo>
                <distancia unidad="metros">217</distancia>
                <coordenadas>
                    <latitud unidad = "grados">2.764410</latitud>
                    <longitud unidad = "grados">101.735641</longitud>
                    <altitud unidad = "metros">28</altitud>
                </coordenadas>
                <sector>2</sector>
            </tramo>
            <tramo>
                <distancia unidad="metros">215</distancia>
                <coordenadas>
                    <latitud unidad = "grados">2.765166</latitud>
                    <longitud unidad = "grados">101.737411</longitud>
                    <altitud unidad = "metros">36</altitud>
                </coordenadas>
                <sector>2</sector>
            </tramo>
            <tramo>
                <distancia unidad="metros">28</distancia>
                <coordenadas>
                    <latitud unidad = "grados">2.765050</latitud>
                    <longitud unidad = "grados">101.737633</longitud>
                    <altitud unidad = "metros">37</altitud>
                </coordenadas>
                <sector>2</sector>
            </tramo>
            <tramo>
                <distancia unidad="metros">265</distancia>
                <coordenadas>
                    <latitud unidad = "grados">2.7625000</latitud>
                    <longitud unidad = "grados">101.7380556</longitud>
                    <altitud unidad = "metros">39</altitud>
                </coordenadas>
                <sector>2</sector>
            </tramo>
            <tramo>
                <distancia unidad="metros">73</distancia>
                <coordenadas>
                    <latitud unidad = "grados">2.7622222</latitud>
                    <longitud unidad = "grados">101.7386111</longitud>
                    <altitud unidad = "metros">37</altitud>
                </coordenadas>
                <sector>2</sector>
            </tramo>
            <tramo>
                <distancia unidad="metros">82</distancia>
                <coordenadas>
                    <latitud unidad = "grados">2.7622222</latitud>
                    <longitud unidad = "grados">101.7391667</longitud>
                    <altitud unidad = "metros">36</altitud>
                </coordenadas>
                <sector>2</sector>
            </tramo>
            <tramo>
                <distancia unidad="metros">78</distancia>
                <coordenadas>
                    <latitud unidad = "grados">2.7625000</latitud>
                    <longitud unidad = "grados">101.7397222</longitud>
                    <altitud unidad = "metros">37</altitud>
                </coordenadas>
                <sector>2</sector>
            </tramo>
            <tramo>
                <distancia unidad="metros">83</distancia>
                <coordenadas>
                    <latitud unidad = "grados">2.762955</latitud>
                    <longitud unidad = "grados">101.740617</longitud>
                    <altitud unidad = "metros">38</altitud>
                </coordenadas>
                <sector>2</sector>
            </tramo>
            <tramo>
                <distancia unidad="metros">71</distancia>
                <coordenadas>
                    <latitud unidad = "grados">2.7627778</latitud>
                    <longitud unidad = "grados">101.7411111</longitud>
                    <altitud unidad = "metros">39</altitud>
                </coordenadas>
                <sector>2</sector>
            </tramo>
            <tramo>
                <distancia unidad="metros">235</distancia>
                <coordenadas>
                    <latitud unidad = "grados">2.76111</latitud>
                    <longitud unidad = "grados">101.74250</longitud>
                    <altitud unidad = "metros">39</altitud>
                </coordenadas>
                <sector>2</sector>
            </tramo>
            <tramo>
                <distancia unidad="metros">80</distancia>
                <coordenadas>
                    <latitud unidad = "grados">2.7605556</latitud>
                    <longitud unidad = "grados">101.7430556</longitud>
                    <altitud unidad = "metros">39</altitud>
                </coordenadas>
                <sector>3</sector>
            </tramo>
            <tramo>
                <distancia unidad="metros">109</distancia>
                <coordenadas>
                    <latitud unidad = "grados">2.7597222</latitud>
                    <longitud unidad = "grados">101.7425000</longitud>
                    <altitud unidad = "metros">38</altitud>
                </coordenadas>
                <sector>2</sector>
            </tramo>
            <tramo>
                <distancia unidad="metros">464</distancia>
                <coordenadas>
                    <latitud unidad = "grados">2.759316</latitud>
                    <longitud unidad = "grados">101.738517</longitud>
                    <altitud unidad = "metros">34</altitud>
                </coordenadas>